id,bid,user_id,用户昵称,微博正文,头条文章url,发布位置,艾特用户,话题,转发数,评论数,点赞数,发布时间,发布工具,微博图片url,微博视频url,retweet_id,ip,user_authentication
5075571524504689,OvHXyiTSh,7920799864,广汽本田袁小华,「黑穿越·猿神」已玩72小时，三大难关无伤通关攻略找我（不是）。L广汽本田袁小华的微博视频,,,,,1,0,2,2024-09-06 11:40,微博视频号,,"http://f.video.weibocdn.com/o0/sKF09M45lx08hNN4Omve01041201apRI0E010.mp4?label=mp4_720p&template=720x1280.24.0&ori=0&ps=1BVp4ysnknHVZu&Expires=1726076638&ssig=MUj6ZWd%2Fxf&KID=unistore,video",,广东,黄V
5074695394951937,OvlarkMdX,6648496109,JR七里庄剑神,一周目打出双结局（多结局竟然没成就，只是多个cg），成就上除了几个需要多周目的也基本拿全，算是走完了游戏流程的第一阶段。这个游戏的短板网友们已经讨论的相当充分，没有地图指引、空气墙、后三章粪怪多、结尾赶工等等，无需赘言。剧情我倒是觉得无功无过，在一个世界观维度上把故事说圆，就足够。况且游戏做得好自有大儒为我辩经，以后多的是黑学家们来共同建构。除了上述问题以外，游戏全都是长板。美术这块长板长出天际，音乐音效战斗玩法都没得说，每个章节结束后的影神图和不同风格动画质量都极高。堆料扎实，文本量巨大，各种小妖、头目、妖王设计考究，和原著中细节也有诸多呼应。核心动作系统花样繁多，可玩性强，而且这应该是3A游戏里唯一一个主角自始至终以棍为兵刃的作品，用棍法的变化代替武器的变化。搭配法宝、法术、变化和精魄系统，让战斗的观赏性和操作性都很不错。做游戏的最高境界可能是造梦吧。我特别喜欢有网友说过的一句话：“你在大马士革骑过马，在欧洲当过海盗，在美国当过射击手，在埃及当过刺客。现在你终于可以回到你的家乡，做你自己的英雄了。”不知道其他人有没有做过这种梦，但我小时候最想成为的对象就是孙悟空。记得刚上小学的时候，外公教我练书法，他跟我说都学写字了，得有字号吧，字我帮你取好了，叫伯渊，号你自己有想法吗？我说有啊，就叫齐天大圣！外公当时笑着说我冒傻气，我还挺不能理解的。齐天大圣就是我的想象天花板，在我刚到学龄的意识里，这就是战力天花板和帅气天花板，哦对了，我还属猴。黑神话是纯正西游也罢，是阴谋论西游也罢，总之它让我拿起手柄就进入了另外一个次元。有时候觉得自己在操作天命人，有时候恍然间又像是在代入幼态的大圣，让我在观音禅院、黄风岭、小西天、盘丝洞、火焰山这些具象的场景里遨游。有几个场景我现在想来还是非常震撼的——金池长老和他的旧观音禅院、虎先锋的血池、浮屠界的魔音、泣血的白骨化晦月魔君、如山一般又奄奄一息牛魔王、法天象地的拳王暴力大战。所以真的挺感谢这个游戏，让我年过三十还能感受到八岁第一次打游戏当十里坡剑神的那种快乐。人要玩游戏，而不是让游戏玩人。我以前不怎么玩ARPG游戏，人到中年操作能力也有限。这几十个小时打下来，基本不在boss战上难为自己，阵亡超过三次又没有解题思路的boss就去翻翻up主们的轮椅打法，比如毒敌、杨戬，避水金睛兽打烦了直接卡bug过。地图和隐藏剧情攻略就更是要做做功课，不然时间都花在迷路上，终局boss也难解。当然有些课是逃不掉的，比如虎先锋、寅虎、小黄龙这种boss，可以很好地理解游戏机制和增加操作熟练度，越往后打就觉得闪身越容易触发。也正是因为这种不较劲的玩法，游戏的游玩体验非常顺畅，张弛有度，很容易进入心流。个人向boss难度top10：1.杨戬2.毒敌大王3.大圣残躯4.避水金睛兽5.石猿6.寅虎7.小黄龙8.晦月魔君9.虎先锋10.大头,,,,,0,3,4,2024-09-04 01:38,Xiaomi 13 Ultra,"https://wx3.sinaimg.cn/large/007fWpydly1htazx59mi0j31hc0u00xi.jpg,https://wx1.sinaimg.cn/large/007fWpydly1htazx5x13cj30uf0cj0ue.jpg,https://wx1.sinaimg.cn/large/007fWpydly1htazx6ovxmj30u01hcwqv.jpg,https://wx4.sinaimg.cn/large/007fWpydly1htazx7c0t0j30u01hcdpo.jpg,https://wx2.sinaimg.cn/large/007fWpydly1htazx825epj30u01dsan5.jpg,https://wx4.sinaimg.cn/large/007fWpydly1htazx8scu6j30u01bw49s.jpg,https://wx2.sinaimg.cn/large/007fWpydly1htazx9etw4j30u01cwn6d.jpg,https://wx3.sinaimg.cn/large/007fWpydly1htazx9wq61j31hc0u07dc.jpg,https://wx2.sinaimg.cn/large/007fWpydly1htazxagevkj31hc0u0qdh.jpg",,,北京,普通用户
5074265848414950,Ov9ZCzj70,1694121092,昨夜丶Sakuya,刷了1、2个小时的泡酒物连一个都刷不出来对着地图看攻略跑路此时猿神和原神的玩法几乎一样妈妈的一个单机有必要搞这么低概率么,,,,,0,5,6,2024-09-02 21:11,微博网页版,https://wx2.sinaimg.cn/large/64fa3c84gy1ht9ofvri91j21z41407mp.jpg,,,江苏,黄V
5072644938400745,OutPfzfpT,5998222487,why_su,黑神话悟空第7日。傍晚回宿舍路上，想想又要离开待了六七年的地方，突然有种物是人非的感觉。正好遇见了同事，聊起了黑神话，他说已经打到30小时，到第三关了，我说我还在第二关迷路中，然后他说要去集齐6个佛目珠，但我现在只找到5个。。回宿舍，猿神启动，打败了石先锋，绕了一圈地图实在没找到新东西，只得去查攻略。然后发现“石母”隐藏在一个非常黑暗的角落里，我足足走了10几次那地方也没发现。。打败石母，找到第6个佛目珠，启动“石敢当”，后面看攻略才发现，如果先不打“石先锋”的话，“石敢当”会帮忙把“石先峰”干掉。下个目标找“定风珠”，继续查攻略。先找“醒酒石”，再和“猪猪”聊天，再去“卧虎寺”找“猪猪”给他吃“莲藕”，再回去打“猪猪”（需要先打败沙大郎获取金光石片），而后进入幻境“斯哈哩国”。遇见原著被孙悟空打败的“虎先锋”，他还透露个信息有2个儿子（一个已经在卧虎寺打败，另一个还没找到）。帮忙“黄风大王”打败了“蝜蝂”（它身体有一个佛像的头，应该是灵吉菩萨，但为何会这般模样），终于获得“定风珠”。继续查攻略看看漏了啥：1.“卧虎寺”使用虎之锋，石之锋可以进入虎头（更像河马头），找到二儿子“疯虎”。2.拨浪鼓要敲3次，才能找到隐藏boss3.沙大郎和沙二郎，要先打败沙大朗，此时再打败沙二郎才能获得沙二郎的变身。但我先打沙二郎了，只能等二周目了。4.沙子滑滑梯的左边有箱子可以拿。5.挑战最终boss黄风大王。咦，沙三郎呢？,,,,,0,5,0,2024-08-29 09:51,OPPO Find X2 Pro,"https://wx1.sinaimg.cn/large/006xVVFZgy1ht4hht40epj31uk0u0qca.jpg,https://wx1.sinaimg.cn/large/006xVVFZgy1ht4hhv0glej31dq0u0tjb.jpg,https://wx4.sinaimg.cn/large/006xVVFZgy1ht4hhwe2r0j31bo0u07gt.jpg,https://wx2.sinaimg.cn/large/006xVVFZgy1ht4hhxye7nj31j80u0qqr.jpg,https://wx2.sinaimg.cn/large/006xVVFZgy1ht4hhz70pmj31a30u04f6.jpg,https://wx4.sinaimg.cn/large/006xVVFZgy1ht4hi0jihoj31iu0u0k3l.jpg,https://wx1.sinaimg.cn/large/006xVVFZgy1ht4hi1xgncj31ja0u0dr9.jpg,https://wx2.sinaimg.cn/large/006xVVFZgy1ht4hi33pl4j31gq0u0108.jpg,https://wx2.sinaimg.cn/large/006xVVFZgy1ht4hi3s3zwj31df0ttdj1.jpg",,,福建,普通用户
5071951185839965,OubMioveZ,7846026269,岳岳原神,原神超话#原神##原神4.8版本##原神4.8版本攻略#米哈游紧跟事实，早就推出了黑神话猿神手游版！L岳岳原神的微博视频,,,,"原神,原神4.8版本,原神4.8版本攻略",0,0,0,2024-08-27 11:54,原神超话,,"http://f.video.weibocdn.com/o0/F1UOkTkklx08hxR8yDQ401041200vneM0E010.mp4?label=mp4_720p&template=1280x720.25.0&ori=0&ps=1BVp4ysnknHVZu&Expires=1726076638&ssig=XvKN2bHHek&KID=unistore,video",,浙江,黄V
5070979929739737,OtMvKERKx,1044479357,麻薯饲养员2号,考完我就又是一条好汉！猿神启动！虎先锋等着我它喵的下午的计算机键盘太他妈难用了，反射弧可能有赤道这么长，严重影响我好不容易的才思泉涌没敲完你最好是分我点22年的好运难得今年感觉没那么糟糕，也可能是长达多年心态逐渐平和（摆烂）本J人要开始做日本攻略了！,,,,,0,0,4,2024-08-24 19:34,iPhone客户端,,,,北京,普通用户
