"""黑神话悟空""+""曝光""的长尾词",长尾词数,竞价词数,全网指数,PC日均流量,移动日均流量
黑神话悟空主角3d模型图曝光,0,0,0,0,0
黑神话悟空首次曝光时间,0,0,0,0,0
黑神话悟空动作捕捉现场曝光,0,0,0,0,0
黑神话悟空目前曝光几个boss,0,0,0,0,0
黑神话悟空游戏画面曝光,0,0,0,0,0
黑神话悟空实机演示曝光,0,0,0,0,0
黑神话悟空最新设计图曝光,0,0,0,0,0
黑神话悟空试玩现场照片曝光,0,0,0,0,0
黑神话悟空四大天王天兵海报曝光了吗,0,0,0,0,0
黑神话悟空第一次曝光,0,0,0,0,0
黑神话悟空首次曝光时间多久,0,0,0,0,0
黑神话悟空试玩画面曝光,0,0,0,0,0
黑神话悟空剧情动画设定曝光,0,0,0,0,0
黑神话悟空新结局曝光,0,0,0,0,0
黑神话悟空亢金龙建模演员曝光,0,0,0,0,0
黑神话悟空铁扇公主新模型曝光,0,0,0,0,0
黑神话悟空预售价格曝光,0,0,0,0,0
黑神话悟空瑞幸联名物料曝光,0,0,0,0,0
黑神话悟空蜘蛛精演员花絮曝光,0,0,0,0,0
黑神话悟空衣装系统曝光,0,0,0,0,0
黑神话悟空视频曝光,0,0,0,0,0
黑神话悟空首次曝光,0,0,0,0,0
黑神话悟空首次曝光时间是多少,0,0,0,0,0
黑神话悟空全新画面曝光在哪里看,0,0,0,0,0
黑神话悟空新dlc曝光,0,0,0,0,0
黑神话悟空曝光新视频,0,0,0,0,0
黑神话悟空上线时间曝光怎么设置,0,0,0,0,0
黑神话悟空动画花絮曝光,0,0,0,0,0
黑神话悟空首次曝光时间是几点,0,0,0,0,0
黑神话悟空pc配置要求曝光,0,0,0,0,0
黑神话悟空外包团队曝光角色形象,0,0,0,0,0
黑神话悟空拜年视频曝光的是那个地图,0,0,0,0,0
黑神话悟空售价曝光,0,0,0,0,0
黑神话悟空第一次曝光是什么时候,0,0,0,0,0
黑神话悟空上线时间曝光了吗,0,0,0,0,0
黑神话悟空配置单曝光,0,0,0,0,0
黑神话悟空四大天王天兵海报曝光,0,0,0,0,0
黑神话悟空大结局曝光,0,0,0,0,0
黑悟空神话发售日曝光,0,0,0,0,0
黑神话悟空首次曝光视频,0,0,0,0,0
黑神话悟空上线时间曝光,0,0,0,0,0
画面惊艳黑神话悟空试玩画面曝光,0,0,0,0,0
