"""黑神话悟空""+""分析""的长尾词",长尾词数,竞价词数,全网指数,PC日均流量,移动日均流量
黑神话悟空新宣传片分析,0,0,0,0,0
黑神话悟空彩蛋分析,0,0,0,0,0
黑神话悟空战斗策划离职分析,0,0,0,0,0
黑神话悟空分析剧情,0,0,0,0,0
黑悟空神话分析,0,0,0,0,0
国外分析黑神话悟空实机演示,0,0,0,0,0
黑神话悟空逐帧分析宣传片,0,0,0,0,0
黑神话悟空音乐鉴赏分析,0,0,0,0,0
黑神话悟空广告创意分析是什么,0,0,0,0,0
黑神话悟空游戏文化评价分析,0,0,0,0,0
黑神话悟空观后感分析,0,0,0,0,0
黑神话悟空全新演示分析,0,0,0,0,0
黑神话悟空第三段演示深度分析视频,0,0,0,0,0
黑神话悟空蜘蛛精分析,0,0,0,0,0
黑神话悟空新实机演示分析,0,0,0,0,0
黑神话悟空第三段演示深度分析图片,0,0,0,0,0
台湾主播对黑神话悟空的分析,0,0,0,0,0
黑神话悟空 剧情分析图,0,0,0,0,0
黑神话悟空小西天分析,0,0,0,0,0
黑神话悟空高难度彩铅画教学分析,0,0,0,0,0
黑神话悟空显卡涨价的原因分析,0,0,0,0,0
悟空黑神话这么火的经济学分析,0,0,0,0,0
黑神话悟空文化元素分析,0,0,0,0,0
黑神话悟空新剧情分析解析,0,0,0,0,0
黑神话悟空里孙悟空的台词分析,0,0,0,0,0
黑神话悟空经济发展趋势图最新分析,0,0,0,0,0
黑神话悟空游戏剧情分析,0,0,0,0,0
黑神话悟空的细节分析,0,0,0,0,0
黑神话悟空人物分析,0,0,0,0,0
黑神话悟空新预告片分析,0,0,0,0,0
黑神话悟空音效分析,0,0,0,0,0
黑神话悟空第三段演示深度分析,0,0,0,0,0
黑神话悟空音效分析软件下载,0,0,0,0,0
悟空黑神话最强游戏细节硬核分析,0,0,0,0,0
黑神话悟空最新分析,0,0,0,0,0
黑神话悟空测评分析,0,0,0,0,0
怎么看待黑神话悟空这个人物的形象分析,0,0,0,0,0
黑神话悟空舆情信息分析,0,0,0,0,0
黑神话悟空时事评论分析,0,0,0,0,0
黑神话悟空背后文化魅力分析,0,0,0,0,0
黑神话悟空孙悟空背景分析,0,0,0,0,0
黑神话悟空三周目对比二周目难度分析,0,0,0,0,0
黑神话悟空演示视频分析,0,0,0,0,0
黑神话悟空剧情分析,0,0,0,0,0
黑悟空神话剧情分析,0,0,0,0,0
黑神话悟空的剧情分析图,0,0,0,0,0
黑神话悟空技术分析,0,0,0,0,0
国外评价黑神话悟空的人物形象分析,0,0,0,0,0
黑神话悟空游戏圈内评价分析,0,0,0,0,0
黑神话悟空宣传视频中视觉色彩分析,0,0,0,0,0
什么是黑神话悟空神话人物分析,0,0,0,0,0
黑神话悟空新剧情分析在线观看,0,0,0,0,0
悟空黑神话评论分析,0,0,0,0,0
黑神话悟空情节分析,0,0,0,0,0
黑神话悟空画面色彩分析,0,0,0,0,0
黑神话悟空故事剧情发展走向分析,0,0,0,0,0
分析为什么黑神话悟空开发视频,0,0,0,0,0
黑神话悟空分析视频,0,0,0,0,0
黑神话悟空原画分析,0,0,0,0,0
黑神话悟空深度分析,0,0,0,0,0
黑神话悟空国外分析,0,0,0,0,0
黑神话悟空的剧情分析,0,0,0,0,0
黑神话悟空第三段演示深度分析图解,0,0,0,0,0
黑神话悟空6分钟分析,0,0,0,0,0
黑神话悟空的剧情分析怎么写,0,0,0,0,0
黑神话悟空游戏分析,0,0,0,0,0
黑神话悟空历史背景分析,0,0,0,0,0
黑神话悟空13分钟演示分析,0,0,0,0,0
关于悟空黑神话的售卖情况分析,0,0,0,0,0
黑神话悟空可玩性分析,0,0,0,0,0
黑神话悟空为什么这么火从语文角度分析,0,0,0,0,0
黑神话悟空新闻评论分析,0,0,0,0,0
从文化传播角度分析黑神话悟空走红的原因,0,0,0,0,0
黑神话悟空标准版和豪华版战力对比分析,0,0,0,0,0
黑神话悟空艺术风格分析,0,0,0,0,0
黑神话悟空虎先锋刀法分析,0,0,0,0,0
黑神话悟空全面分析,0,0,0,0,0
黑神话悟空新剧情分析,0,0,0,0,0
黑神话悟空第三段演示深度分析视频在线观看,0,0,0,0,0
黑神话 悟空 主角分析,0,0,0,0,0
黑神话悟空宣传片分析,0,0,0,0,0
黑神话悟空与其他游戏对比分析,0,0,0,0,0
黑神话悟空6分钟剧情分析大全,0,0,0,0,0
如何评价黑神话:悟空的人物形象分析,0,0,0,0,0
黑神话悟空建筑及服装分析,0,0,0,0,0
怎么看待黑神话悟空的人物形象分析,0,0,0,0,0
外国博主如何看待悟空黑神话的真实性分析,0,0,0,0,0
黑神话悟空新剧情分析图,0,0,0,0,0
黑神话悟空和其他游戏比较图表分析,0,0,0,0,0
黑神话悟空场景分析,0,0,0,0,0
黑神话悟空细节分析,0,0,0,0,0
分析黑神话悟空,0,0,0,0,0
台湾主播对黑神话悟空的分析报告,0,0,0,0,0
台湾主播对黑神话悟空的分析视频,0,0,0,0,0
老外看黑神话悟空剧情分析,0,0,0,0,0
黑神话悟空6分钟实机剧情分析,0,0,0,0,0
黑神话悟空 剧情分析详细,0,0,0,0,0
黑神话悟空 剧情分析详解,0,0,0,0,0
黑神话悟空特效分析,0,0,0,0,0
黑神话悟空实机剧情分析,0,0,0,0,0
黑神话悟空剧情短片分析,0,0,0,0,0
如何评价黑神话:悟空的人物分析,0,0,0,0,0
黑神话悟空美国官媒评价分析,0,0,0,0,0
瑞幸和黑神话悟空联名数据分析,0,0,0,0,0
从**角度分析黑神话悟空为什么这么火,0,0,0,0,0
黑神话悟空和只狼有什么区别图片对比分析,0,0,0,0,0
黑神话悟空分析,0,0,0,0,0
黑神话悟空战斗分析,0,0,0,0,0
逐帧分析黑神话悟空,0,0,0,0,0
黑神话悟空画面分析,0,0,0,0,0
黑神话悟空 剧情分析,0,0,0,0,0
黑神话悟空cg分析,0,0,0,0,0
黑神话悟空cg宣传片分析,0,0,0,0,0
黑神话悟空特效技巧视频教学分析,0,0,0,0,0
怎样评价黑神话悟空的人物形象分析,0,0,0,0,0
黑神话悟空营销策略分析,0,0,0,0,0
黑神话悟空受众分析,0,0,0,0,0
黑神话悟空女性角色分析,0,0,0,0,0
黑神话悟空第三章过场动画分析,0,0,0,0,0
黑神话悟空美术人物元素分析,0,0,0,0,0
黑神话悟空文化解读解析评价分析,0,0,0,0,0
黑神话悟空作文素材事例分析,0,0,0,0,0
黑神话悟空游戏中人物服装设计分析,0,0,0,0,0
黑神话悟空从国际传播策略分析,0,0,0,0,0
黑神话悟空第三章夜生白露剧情分析全文,0,0,0,0,0
瑞幸咖啡与黑神话悟空联名网络营销分析研究,0,0,0,0,0
瑞幸咖啡与黑神话悟空联名网络营销策略分析,0,0,0,0,0
黑神话悟空性别画像分析,0,0,0,0,0
黑神话悟空里的主要人物分析,0,0,0,0,0
原神及黑神话悟空游戏特点分析,0,0,0,0,0
黑神话悟空第三段演示深度分析图,0,0,0,0,0
台湾主播对黑神话悟空的分析是什么,0,0,0,0,0
黑神话悟空8月新剧情分析,0,0,0,0,0
黑神话悟空的剧情分析是什么,0,0,0,0,0
黑神话悟空线性分析,0,0,0,0,0
黑神话悟空第二支国外评测分析,0,0,0,0,0
黑神话悟空是什么人物形象分析,0,0,0,0,0
黑神话悟空国外评论分析,0,0,0,0,0
黑神话悟空的宗教色彩分析,0,0,0,0,0
黑神话悟空色彩分析,0,0,0,0,0
如何分析黑神话悟空剧情梗概,0,0,0,0,0
黑神话悟空背后文化魅力分析是什么,0,0,0,0,0
黑神话悟空央视评分析,0,0,0,0,0
黑神话悟空成功案例分析,0,0,0,0,0
瑞幸咖啡与黑神话悟空联名网络营销分析,0,0,0,0,0
黑神话悟空股权结构分析,0,0,0,0,0
黑神话悟空角色分析,0,0,0,0,0
黑神话悟空逐帧分析,0,0,0,0,0
黑神话悟空宣传片细节分析,0,0,0,0,0
黑神话悟空虎年分析,0,0,0,0,0
如何评价黑神话:悟空的人物性格分析,0,0,0,0,0
黑神话悟空数据分析,0,0,0,0,0
黑神话悟空游戏场景设计分析研究,0,0,0,0,0
黑神话悟空美学分析,0,0,0,0,0
黑神话悟空新剧情分析详解,0,0,0,0,0
黑悟空神话官网开发背景分析,0,0,0,0,0
悟空黑神话题材分析,0,0,0,0,0
黑神话悟空评论分析,0,0,0,0,0
西游记与黑神话悟空文化内核比较分析,0,0,0,0,0
黑神话悟空的销售量统计图分析,0,0,0,0,0
黑神话悟空用户性别分析,0,0,0,0,0
黑神话悟空千里江山图服饰分析,0,0,0,0,0
