"""黑神话悟空""+""位置""的长尾词",长尾词数,竞价词数,全网指数,PC日均流量,移动日均流量
黑神话悟空第四章壁画在那个位置了,0,0,0,0,0
黑神话悟空项目组在什么位置,0,0,0,0,0
黑神话悟空浮屠塔小张太子位置,0,0,0,0,0
怎么找到黑神话悟空自己的存档位置,0,0,0,0,0
黑神话悟空花果山水帘洞位置怎么去,0,0,0,0,0
黑神话悟空存档位置在哪里显示,0,0,0,0,0
黑神话悟空9个灯笼怪位置,0,0,0,0,0
黑神话悟空截图位置,0,0,0,0,0
黑神话悟空三次撞钟位置在哪,0,0,0,0,0
steam黑神话悟空存档位置在哪里,0,0,0,0,0
黑神话悟空隐藏boss位置,0,0,0,0,0
黑神话悟空steam存档位置在哪里,0,0,0,0,0
黑神话悟空6个佛头位置,0,0,0,0,0
黑神话悟空第三章全boss位置攻略最新,0,0,0,0,0
黑神话悟空第一章所有妖王位置,0,0,0,0,0
黑悟空神话存档位置在哪,0,0,0,0,0
黑神话悟空第三章老人参精位置,0,0,0,0,0
黑神话悟空第三章蝙蝠尸体位置在哪,0,0,0,0,0
黑神话悟空第三回神将位置,0,0,0,0,0
黑神话悟空第三章拜佛位置,0,0,0,0,0
黑神话悟空小黄龙位置在哪里,0,0,0,0,0
黑神话悟空马哥位置,0,0,0,0,0
黑神话悟空花果山大石敢当位置,0,0,0,0,0
黑神话悟空虎先锋位置,0,0,0,0,0
黑神话悟空存档位置,0,0,0,0,0
黑神话悟空浮屠界灯笼怪位置,0,0,0,0,0
黑神话悟空9个灯笼怪位置在哪里,0,0,0,0,0
黑神话悟空浮屠塔灯笼怪位置,0,0,0,0,0
黑神话悟空戌狗位置,0,0,0,0,0
黑神话悟空望犀坡土地庙位置,0,0,0,0,0
黑神话悟空工作室位置,0,0,0,0,0
黑神话悟空阵亡画面怎么调整位置的视频,0,0,0,0,0
黑神话悟空存档文件位置,0,0,0,0,0
黑神话悟空小雷音寺土地庙位置,0,0,0,0,0
黑神话悟空虎先锋位置在哪里,0,0,0,0,0
黑神话悟空蝎太子位置,0,0,0,0,0
黑神话悟空打坐位置图,0,0,0,0,0
黑神话悟空午马位置,0,0,0,0,0
黑神话悟空小西天打坐位置顺序,0,0,0,0,0
黑神话悟空广智位置,0,0,0,0,0
黑神话悟空花果山土地庙位置,0,0,0,0,0
黑神话悟空小雷音寺土地庙位置在哪里,0,0,0,0,0
黑神话悟空花果山宝箱位置,0,0,0,0,0
黑神话悟空石先锋位置,0,0,0,0,0
黑神话悟空音乐文件本地位置,0,0,0,0,0
黑神话悟空镇风门土地庙位置,0,0,0,0,0
黑神话悟空长生大道焦面鬼王位置,0,0,0,0,0
黑神话悟空石先锋位置怎么去,0,0,0,0,0
黑神话悟空树珍珠位置,0,0,0,0,0
黑神话悟空备份存档位置,0,0,0,0,0
黑神话悟空真大圣套位置,0,0,0,0,0
黑神话悟空游戏购买位置介绍,0,0,0,0,0
黑神话悟空四条龙位置,0,0,0,0,0
黑神话悟空小西天蒲团位置,0,0,0,0,0
黑神话悟空存档位置steam,0,0,0,0,0
黑神话悟空四小龙位置,0,0,0,0,0
黑神话悟空三冬虫所有位置,0,0,0,0,0
黑神话悟空土地庙位置,0,0,0,0,0
黑神话悟空三清令位置介绍,0,0,0,0,0
黑神话悟空游戏定位怎么改变位置,0,0,0,0,0
黑神话悟空游戏定位怎么改不了位置,0,0,0,0,0
黑神话悟空游戏展厅在哪个位置,0,0,0,0,0
黑神话悟空的截图保存的位置,0,0,0,0,0
黑神话悟空配置文件位置,0,0,0,0,0
steam黑神话悟空存档位置,0,0,0,0,0
黑神话悟空苦海南岸土地庙位置,0,0,0,0,0
黑神话悟空四蕴位置,0,0,0,0,0
黑神话悟空魔将三将位置,0,0,0,0,0
黑神话悟空花果山大圣套装地图位置,0,0,0,0,0
黑神话悟空灯笼怪位置,0,0,0,0,0
黑神话悟空花果山位置图,0,0,0,0,0
黑神话悟空飞龙鳞片位置,0,0,0,0,0
黑神话悟空boss位置,0,0,0,0,0
黑神话悟空杨戬位置,0,0,0,0,0
黑神话悟空小西天戌狗位置,0,0,0,0,0
黑神话悟空阵亡画面怎么调整位置视频,0,0,0,0,0
黑神话悟空阵亡画面怎么调整位置图片,0,0,0,0,0
黑神话悟空阵亡画面怎么调整位置的视频教程,0,0,0,0,0
黑神话悟空三口钟位置,0,0,0,0,0
黑神话悟空四龙位置,0,0,0,0,0
黑神话悟空斯哈里国位置,0,0,0,0,0
黑神话悟空隐藏地图位置,0,0,0,0,0
黑神话悟空火焰山五行车位置,0,0,0,0,0
黑神话悟空蛇捕头刷新位置,0,0,0,0,0
黑神话悟空第二章沙大朗位置,0,0,0,0,0
黑神话悟空增加法力值的药位置,0,0,0,0,0
黑神话悟空浮屠界紫色门位置在哪里,0,0,0,0,0
黑神话悟空左手虫位置,0,0,0,0,0
黑神话悟空第四章土地庙位置,0,0,0,0,0
黑神话悟空第二章佛头位置在哪里,0,0,0,0,0
黑神话悟空花果山杨戬位置,0,0,0,0,0
像素版黑神话悟空三口红中的位置,0,0,0,0,0
黑神话悟空二郎神支线位置,0,0,0,0,0
黑神话悟空视频在游戏哪个位置,0,0,0,0,0
黑神话悟空团队位置,0,0,0,0,0
黑神话悟空阵亡画面怎么调整位置视频教程,0,0,0,0,0
黑神话悟空第二章佛眼位置,0,0,0,0,0
黑神话悟空里面的浮屠界灯笼怪都在那个位置,0,0,0,0,0
黑神话悟空第三章魔将白鸡位置,0,0,0,0,0
黑神话悟空第三章海上僧位置,0,0,0,0,0
黑神话悟空通臂猿猴位置,0,0,0,0,0
黑神话悟空滨铁砂第二章位置怎么去,0,0,0,0,0
黑神话悟空火焰山蒲团位置,0,0,0,0,0
黑神话悟空雷榍位置,0,0,0,0,0
黑神话悟空隐藏龙位置,0,0,0,0,0
黑神话悟空毒敌大王位置,0,0,0,0,0
黑神话悟空狼刺客位置,0,0,0,0,0
黑神话悟空阵亡画面怎么调整位置,0,0,0,0,0
黑神话悟空阵亡画面怎么调整位置图片教程,0,0,0,0,0
黑神话悟空阵亡画面怎么调整位置的,0,0,0,0,0
黑神话悟空佛头位置,0,0,0,0,0
黑神话悟空第一章三个钟位置,0,0,0,0,0
黑神话悟空steam存档位置,0,0,0,0,0
黑神话悟空第二章葫芦仙人位置,0,0,0,0,0
黑神话悟空二层掌灯狱使位置顺序,0,0,0,0,0
悟空黑神话小马哥位置在哪里,0,0,0,0,0
黑神话悟空花果山头目位置,0,0,0,0,0
黑神话悟空的拍照保存的位置,0,0,0,0,0
黑神话悟空的拍照保存的位置是哪里,0,0,0,0,0
黑神话悟空音乐文件本地位置在哪里,0,0,0,0,0
黑神话悟空第三章土地庙位置,0,0,0,0,0
黑神话悟空浮屠塔壁画位置,0,0,0,0,0
黑神话悟空太乙紫金丹位置大全,0,0,0,0,0
黑神话悟空全土地庙位置,0,0,0,0,0
黑神话悟空二郎神杨戬位置,0,0,0,0,0
黑神话悟空头目海上僧位置,0,0,0,0,0
黑神话悟空四大魔将位置,0,0,0,0,0
黑神话悟空色第二目吉祥灯位置,0,0,0,0,0
黑神话悟空狼**位置,0,0,0,0,0
黑神话悟空阵亡画面怎么调整位置视频教学,0,0,0,0,0
黑神话悟空游戏展位置,0,0,0,0,0
黑神话悟空存档位置在哪里,0,0,0,0,0
黑神话悟空花果山装备位置,0,0,0,0,0
黑神话悟空第六章宝箱位置,0,0,0,0,0
黑神话悟空小西天打坐位置,0,0,0,0,0
黑神话悟空弥勒位置,0,0,0,0,0
黑神话悟空佛珠位置,0,0,0,0,0
黑神话悟空花果山跳浪蛟位置,0,0,0,0,0
黑神话悟空香炉位置在哪里,0,0,0,0,0
黑神话悟空第二章石敢当位置在哪里,0,0,0,0,0
黑神话悟空树珍珠采集位置,0,0,0,0,0
黑神话悟空第二章六个佛头位置,0,0,0,0,0
黑神话悟空第二章佛珠位置,0,0,0,0,0
黑神话悟空小张太子在什么位置,0,0,0,0,0
