"""黑神话悟空""+""事件""的长尾词",长尾词数,竞价词数,全网指数,PC日均流量,移动日均流量
黑神话悟空腾讯事件是真的吗,0,0,0,0,0
黑神话悟空的辱女事件,0,0,0,0,0
黑神话悟空舆情事件全梳理,0,0,0,0,0
黑神话悟空主美杨奇微博截图事件是什么,0,0,0,0,0
黑神话悟空第三章隐藏事件怎么触发,0,0,0,0,0
如何评价黑神话悟空女妖精事件,0,0,0,0,0
黑神话悟空辱女事件始末,0,0,0,0,0
黑神话悟空+漏屎事件,0,0,0,0,0
黑神话悟空主美杨奇微博截图事件,0,0,0,0,0
黑神话悟空事件作文素材,0,0,0,0,0
黑神话悟空第三回隐藏事件,0,0,0,0,0
悟空黑暗神话评论事件,0,0,0,0,0
黑神话之悟空团队被挖事件,0,0,0,0,0
如何看待黑神话悟空辱女事件,0,0,0,0,0
黑神话悟空 七月七日事件,0,0,0,0,0
黑神话悟空第四章隐藏事件,0,0,0,0,0
谈黑神话悟空制作人尤卡言论事件,0,0,0,0,0
黑神话悟空黑风山隐藏事件,0,0,0,0,0
黑神话悟空第三章隐藏事件,0,0,0,0,0
黑神话悟空第四章盘丝洞隐藏事件,0,0,0,0,0
黑神话悟空女妖事件解析,0,0,0,0,0
黑神话悟空挖人事件,0,0,0,0,0
黑神话悟空招聘广告事件,0,0,0,0,0
如何看待黑神话悟空事件,0,0,0,0,0
黑神话悟空女拳事件,0,0,0,0,0
如何看待黑神话悟空泄露事件,0,0,0,0,0
黑神话悟空直播事件,0,0,0,0,0
黑神话悟空泄漏事件,0,0,0,0,0
如何评价黑神话悟空女妖事件,0,0,0,0,0
黑神话悟空涂鸦事件始末,0,0,0,0,0
如何评价黑神话悟空的涂鸦事件,0,0,0,0,0
黑神话悟空唢呐事件,0,0,0,0,0
怎么评价黑神话悟空辱女事件,0,0,0,0,0
黑神话悟空女妖精事件解析,0,0,0,0,0
黑神话悟空被群嘲差评的事件,0,0,0,0,0
黑神话悟空腾讯事件,0,0,0,0,0
黑神话悟空投资事件,0,0,0,0,0
2021年黑神话悟空事件,0,0,0,0,0
黑神话悟空悟空辱女事件,0,0,0,0,0
黑神话悟空联名事件始末,0,0,0,0,0
央视评价黑神话悟空事件,0,0,0,0,0
黑神话悟空事件,0,0,0,0,0
黑神话悟空第一回隐藏事件,0,0,0,0,0
怎么看待黑神话悟空泄露事件,0,0,0,0,0
黑神话悟空黑熊领所有隐藏事件,0,0,0,0,0
黑神话悟空新闻事件概述加写作素材积累,0,0,0,0,0
如何评价黑神话悟空辱女事件,0,0,0,0,0
怎么看待黑神话悟空的人物形象和事件,0,0,0,0,0
黑神话悟空+泄露事件,0,0,0,0,0
黑神话悟空锦斓袈裟事件,0,0,0,0,0
黑神话悟空抄袭事件,0,0,0,0,0
黑神话悟空第二章隐藏事件,0,0,0,0,0
黑神话悟空早期辱女事件,0,0,0,0,0
黑神话悟空引发热议事件,0,0,0,0,0
黑神话悟空沙二郎隐藏事件,0,0,0,0,0
黑神话悟空第二回隐藏事件,0,0,0,0,0
