"""黑神话悟空""+""最好""的长尾词",长尾词数,竞价词数,全网指数,PC日均流量,移动日均流量
黑悟空神话选什么宠物最好,0,0,0,0,0
黑神话悟空哪里做的最好,0,0,0,0,0
黑神话悟空是目前最好的游戏吗英文版,0,0,0,0,0
黑神话悟空用什么机器玩比较好用最好,0,0,0,0,0
悟空黑神话用哪个机器玩比较好一点最好,0,0,0,0,0
悟空黑神话什么时候发行的游戏最好,0,0,0,0,0
全民斗战神和黑神话悟空哪个厉害点最好,0,0,0,0,0
黑暗神话悟空手机版什么时候上线的最好,0,0,0,0,0
黑神话悟空在哪个平台出售最好,0,0,0,0,0
黑神话悟空角色配音是谁唱的最好,0,0,0,0,0
黑神话悟空最好在哪个平台玩,0,0,0,0,0
黑神话悟空在哪个平台上发售最好,0,0,0,0,0
黑悟空神话哪里下载的最好,0,0,0,0,0
黑神话悟空电脑画质怎么调高最好,0,0,0,0,0
黑神话悟空端游怎么玩最好,0,0,0,0,0
黑神话悟空哪个平台入手最好,0,0,0,0,0
黑神话悟空顶级画面在哪买最好,0,0,0,0,0
黑悟空神话实景拍摄怎么拍最好,0,0,0,0,0
黑神话悟空第二章出来的弓箭手怎么打最好,0,0,0,0,0
黑神话悟空什么时候打折最好,0,0,0,0,0
黑神话悟空最好的葫芦,0,0,0,0,0
黑悟空神话在哪个平台玩最好,0,0,0,0,0
黑神话悟空没有双头鼠怎么刷最好,0,0,0,0,0
黑神话悟空前期怎么加点最好,0,0,0,0,0
黑神话悟空什么酒补元气最好,0,0,0,0,0
黑神话悟空新年预告片谁做的最好,0,0,0,0,0
黑神话悟空谁画的最好图片,0,0,0,0,0
黑神话悟空游戏用什么玩法玩最好,0,0,0,0,0
黑神话悟空使用什么玩具最好,0,0,0,0,0
黑神话悟空什么模式出的最快最好,0,0,0,0,0
黑神话悟空拿什么玩具做的最好,0,0,0,0,0
黑神话悟空七龙珠怎么获得技能最好,0,0,0,0,0
黑神话悟空在哪个平台上玩最好,0,0,0,0,0
黑神话悟空从哪里买最好,0,0,0,0,0
黑神话悟空什么时间出场最多最好,0,0,0,0,0
黑神话悟空游戏怎么玩最好,0,0,0,0,0
暗黑4和黑神话悟空哪个先出来最好,0,0,0,0,0
黑神话悟空顶级画面在哪设置最好,0,0,0,0,0
黑神话悟空什么时候上线在哪里玩最好,0,0,0,0,0
黑悟空神话什么时候发布最好,0,0,0,0,0
黑悟空神话什么时候出的游戏手机版最好,0,0,0,0,0
用什么玩黑神话悟空游戏最好,0,0,0,0,0
黑悟空神话在哪个平台的最好,0,0,0,0,0
黑神话悟空cg世界3d模型怎么用最好,0,0,0,0,0
黑神话悟空蚂蚱怎么抓最好,0,0,0,0,0
黑神话悟空青田葫芦搭配哪些泡酒最好,0,0,0,0,0
黑神话悟空和只狼哪个先出的最好,0,0,0,0,0
黑神话悟空什么团队制作的最好,0,0,0,0,0
黑神话悟空用什么做的技能最好,0,0,0,0,0
黑神话悟空最好画质是什么,0,0,0,0,0
黑神话悟空使用什么玩法最好,0,0,0,0,0
黑神话悟空用什么机器玩比较好玩最好,0,0,0,0,0
黑神话悟空游戏根据什么小说最好,0,0,0,0,0
黑神话悟空什么难度最好,0,0,0,0,0
悟空黑神话用哪个机器玩好一点最好,0,0,0,0,0
黑神话悟空首发在哪个平台看最好,0,0,0,0,0
全民斗战神和黑神话悟空哪个强一些最好,0,0,0,0,0
黑神话悟空pc端什么时候上线的最好,0,0,0,0,0
黑神话悟空运行在哪个平台看最好,0,0,0,0,0
黑神话悟空壁纸在哪里设置最好,0,0,0,0,0
黑神话悟空用到哪些软件玩最好,0,0,0,0,0
暗黑4和黑神话悟空哪个先出的最好,0,0,0,0,0
黑神话悟空 天命人怎么打最好,0,0,0,0,0
黑神话悟空的原图插画怎么画的最好,0,0,0,0,0
黑神话悟空与什么游戏媲美最好,0,0,0,0,0
黑神话悟空视角锁定怎么设置最好,0,0,0,0,0
黑神话悟空怎么加技能点战斗力最强最好,0,0,0,0,0
黑神话悟空最好听的歌曲,0,0,0,0,0
黑神话悟空大头怪怎么画最好又好看,0,0,0,0,0
黑神话悟空晦月魔君怎么打最好,0,0,0,0,0
黑神话悟空红孩儿二形态怎么打最好,0,0,0,0,0
黑神话悟空最好的装备,0,0,0,0,0
黑神话悟空是目前最好的游戏吗英文翻译,0,0,0,0,0
黑神话悟空谁画的最好,0,0,0,0,0
黑神话悟空演示哪里看最好,0,0,0,0,0
黑神话悟空首发在哪个平台买最好,0,0,0,0,0
黑神话悟空什么模式打龙最好,0,0,0,0,0
悟空黑神话什么时候发行最好,0,0,0,0,0
黑神话悟空在哪里买金币最好,0,0,0,0,0
黑神话悟空几月出的新版最好,0,0,0,0,0
黑神话悟空盗版游戏有哪些版本最好,0,0,0,0,0
黑神话悟空游戏根据什么制作的游戏最好,0,0,0,0,0
黑神话悟空角色建模女妖精怎么画图片最好,0,0,0,0,0
黑神话悟空用什么主机玩的游戏最好,0,0,0,0,0
黑神话悟空打败猪八戒怎么走最好,0,0,0,0,0
黑神话悟空8分钟怎么玩最好,0,0,0,0,0
黑神话悟空和只狼哪个先出来的最好,0,0,0,0,0
黑神话悟空最好画质是多少,0,0,0,0,0
黑神话悟空什么公司的最好,0,0,0,0,0
黑神话悟空什么模式打的最好,0,0,0,0,0
黑神话悟空到底什么时候发售的游戏最好,0,0,0,0,0
黑悟空神话最高画质配置多少帧数最好,0,0,0,0,0
黑悟空神话最高画质配置多少帧率最好,0,0,0,0,0
黑神话悟空在哪里购买最好,0,0,0,0,0
黑神话悟空在哪个平台购买正版最好,0,0,0,0,0
黑神话悟空用什么电脑玩比较好最好,0,0,0,0,0
黑神话悟空那个团队最好,0,0,0,0,0
黑神话悟空里面的猪八戒怎么画最好,0,0,0,0,0
黑神话悟空什么时间出的游戏最好,0,0,0,0,0
黑悟空神话视觉图怎么画的最好,0,0,0,0,0
黑神话悟空什么地方刷级最好,0,0,0,0,0
黑神话悟空碧水金睛兽怎么打最好,0,0,0,0,0
黑神话悟空是目前最好的游戏吗英文怎么说,0,0,0,0,0
黑暗神话悟空什么引擎做的最好,0,0,0,0,0
黑神话悟空什么平台首发最好,0,0,0,0,0
黑神话悟空首发在哪里领最好,0,0,0,0,0
黑神话悟空哪个国家开发的最好,0,0,0,0,0
黑神话悟空哪里做的最好的地方,0,0,0,0,0
黑神话悟空哪里做的最好排行榜,0,0,0,0,0
黑神话悟空在哪买最好,0,0,0,0,0
黑神话悟空什么时间出场的最好,0,0,0,0,0
黑神话悟空哪里出的最好,0,0,0,0,0
黑神话悟空要什么配置玩最好,0,0,0,0,0
黑神话悟空用什么主机玩好一点最好,0,0,0,0,0
黑神话悟空ps4什么时候上线的最好,0,0,0,0,0
黑神话悟空在哪个平台玩最好,0,0,0,0,0
黑神话悟空天命人怎么打的最好,0,0,0,0,0
黑神话悟空顶级画面怎么设置的最好,0,0,0,0,0
黑神话悟空图文介绍怎么写最好,0,0,0,0,0
黑神话悟空什么时候发的视频最好,0,0,0,0,0
黑神话悟空最好看人物,0,0,0,0,0
黑神话悟空蟋蟀怎么抓最好,0,0,0,0,0
黑神话悟空杨戬浮屠塔怎么走最好,0,0,0,0,0
黑神话悟空最好的兵器是什么,0,0,0,0,0
黑神话悟空用什么玩的最好,0,0,0,0,0
黑神话悟空什么时候预购最好,0,0,0,0,0
黑暗神话悟空是用什么机子玩最好,0,0,0,0,0
黑神话悟空在哪个平台试玩最好,0,0,0,0,0
黑神话悟空用什么玩具最好,0,0,0,0,0
黑神话悟空什么模式最强大最好,0,0,0,0,0
黑悟空神话在哪个平台直播最好,0,0,0,0,0
全民斗战神和黑神话悟空哪个强一点最好,0,0,0,0,0
黑神话悟空片尾曲谁唱的歌最好,0,0,0,0,0
黑神话悟空主机板怎么用最好,0,0,0,0,0
黑神话悟空用了腾讯的什么软件看最好,0,0,0,0,0
黑神话悟空什么玩法最好,0,0,0,0,0
黑神话悟空对标什么游戏最好,0,0,0,0,0
黑神话悟空什么配置最好,0,0,0,0,0
黑神话悟空用什么主机玩比较好一点最好,0,0,0,0,0
黑神话悟空顶级画面在哪看最好,0,0,0,0,0
黑神话悟空amd核显画质怎么调最好,0,0,0,0,0
黑神话悟空寅虎怎么打最好,0,0,0,0,0
黑神话悟空亢金龙怎么打最好的办法有哪些,0,0,0,0,0
黑神话悟空在哪买回血药最好,0,0,0,0,0
黑神话悟空最好画质,0,0,0,0,0
黑神话悟空什么剧情最好,0,0,0,0,0
玩黑神话悟空用什么设备最好,0,0,0,0,0
黑神话悟空用什么平台玩最好,0,0,0,0,0
黑神话悟空拿什么玩具打最好,0,0,0,0,0
黑神话悟空哪里购买最好,0,0,0,0,0
黑神话悟空 怎么购买最好,0,0,0,0,0
悟空黑神话什么时候发行的手游最好,0,0,0,0,0
黑神话悟空什么模式最强玩家最好,0,0,0,0,0
黑神话悟空会上线哪个平台最好,0,0,0,0,0
黑神话悟空用什么电脑玩的最好,0,0,0,0,0
黑悟空神话 手游怎么玩最好,0,0,0,0,0
黑神话悟空从哪下最好,0,0,0,0,0
黑神话悟空用了腾讯的什么软件下载最好,0,0,0,0,0
黑神话悟空设定稿怎么写最好,0,0,0,0,0
黑神话悟空在哪玩最好,0,0,0,0,0
黑神话悟空神品葫芦怎么得最好的办法,0,0,0,0,0
黑神话悟空杨戬传送到哪里最好,0,0,0,0,0
黑神话悟空游戏电脑配置推荐怎么选最好,0,0,0,0,0
黑神话悟空细金丝打造什么最好,0,0,0,0,0
黑神话悟空最好的文案短句,0,0,0,0,0
黑神话悟空大头怪怎么画最好又好看素描,0,0,0,0,0
黑神话悟空是目前最好的游戏吗,0,0,0,0,0
黑神话悟空是目前最好的游戏吗英文,0,0,0,0,0
黑神话悟空最好画质是哪个,0,0,0,0,0
黑神话悟空最好的宣传片,0,0,0,0,0
黑神话悟空将在哪个平台购买最好,0,0,0,0,0
黑神话悟空用什么机器玩比较好一点最好,0,0,0,0,0
黑悟空神话哪里下载安装最好,0,0,0,0,0
黑神话悟空根据什么小说最好,0,0,0,0,0
黑神话悟空全新演示哪个平台最好,0,0,0,0,0
黑神话悟空的世界观怎么写的最好,0,0,0,0,0
黑悟空神话哪家公司的最好,0,0,0,0,0
黑悟空神话什么酒最好,0,0,0,0,0
黑神话悟空耳听怒学什最好,0,0,0,0,0
黑神话悟空用啥显卡最好,0,0,0,0,0
黑神话悟空什么软件制作最好,0,0,0,0,0
黑神话悟空用什么玩法最好,0,0,0,0,0
黑神话悟空用什么玩最好,0,0,0,0,0
黑神话悟空首发在哪里买最好,0,0,0,0,0
黑神话悟空怪物图鉴在哪看最好,0,0,0,0,0
黑悟空神话最高画质配置多少帧最好,0,0,0,0,0
黑神话悟空关注度怎么提升最好,0,0,0,0,0
黑神话悟空哪年开始做的最好,0,0,0,0,0
黑神话悟空运行在哪个平台下载最好,0,0,0,0,0
黑神话悟空什么级别最强最好,0,0,0,0,0
黑神话悟空股票怎么买最好,0,0,0,0,0
黑神话悟空电脑画质怎么调整最好,0,0,0,0,0
黑神话悟空电脑画质怎么调节最好,0,0,0,0,0
黑神话悟空是哪个品牌出的最好,0,0,0,0,0
黑神话悟空角色配音是谁配的最好,0,0,0,0,0
黑神话悟空用谁的技术最好,0,0,0,0,0
黑神话悟空最好配置,0,0,0,0,0
悟空黑暗神话在哪玩最好,0,0,0,0,0
