"""黑神话悟空""+""顺序""的长尾词",长尾词数,竞价词数,全网指数,PC日均流量,移动日均流量
黑神话悟空日本人观看顺序图,0,0,0,0,0
黑神话 悟空所有实际演示顺序,0,0,0,0,0
黑神话悟空怪物出场顺序,0,0,0,0,0
黑神话悟空葫芦升阶顺序,0,0,0,0,0
黑神话悟空急如火和快如风打的顺序,0,0,0,0,0
黑神话悟空妖怪顺序是什么,0,0,0,0,0
黑神话悟空观看顺序,0,0,0,0,0
黑神话悟空赤金战车怎么触发顺序,0,0,0,0,0
悟空黑神话上线时间顺序,0,0,0,0,0
黑悟空神话实景演出时间顺序,0,0,0,0,0
黑悟空神话boss顺序,0,0,0,0,0
黑神话悟空通关顺序详解,0,0,0,0,0
黑神话悟空葫芦全收集顺序,0,0,0,0,0
黑神话悟空boss顺序,0,0,0,0,0
黑神话悟空宣传片全部视频播放顺序,0,0,0,0,0
游戏科学黑神话悟空发售时间顺序,0,0,0,0,0
黑神话悟空通关顺序图,0,0,0,0,0
黑神话悟空第一章打怪顺序最新,0,0,0,0,0
黑神话悟空游记全部头目顺序,0,0,0,0,0
黑神话悟空外国人观看顺序,0,0,0,0,0
黑神话悟空打坐点顺序,0,0,0,0,0
各大主播对黑神话悟空的看法视频播放顺序,0,0,0,0,0
黑神话悟空装备锻造顺序,0,0,0,0,0
黑神话悟空妖怪顺序,0,0,0,0,0
黑神话悟空黑风山打坐顺序,0,0,0,0,0
黑神话悟空全国取景地有哪些顺序,0,0,0,0,0
黑神话悟空酒葫芦收集顺序,0,0,0,0,0
黑神话悟空小西天打坐位置顺序,0,0,0,0,0
黑神话悟空四处拜佛顺序,0,0,0,0,0
黑神话悟空兵器铸造顺序,0,0,0,0,0
黑神话悟空第二章所有隐藏物品顺序,0,0,0,0,0
黑神话悟空连招顺序怎么看,0,0,0,0,0
黑神话悟空高清妖怪建模顺序,0,0,0,0,0
黑神话悟空金箍棒建模顺序,0,0,0,0,0
黑神话悟空第二章boss顺序,0,0,0,0,0
黑神话悟空装备升级顺序,0,0,0,0,0
黑神话悟空仙品大圣套装获得顺序,0,0,0,0,0
黑神话悟空打boss顺序,0,0,0,0,0
黑神话悟空装备打造顺序,0,0,0,0,0
黑神话悟空第一章全收集顺序,0,0,0,0,0
黑神话悟空大圣套装获得顺序,0,0,0,0,0
黑神话悟空初始葫芦升级金色顺序,0,0,0,0,0
黑神话悟空连招顺序攻略,0,0,0,0,0
黑神话悟空公布时间顺序,0,0,0,0,0
黑神话悟空boss出场顺序,0,0,0,0,0
黑神话悟空怪物顺序,0,0,0,0,0
黑神话悟空火焰山全收集顺序,0,0,0,0,0
黑神话悟空第四章所有boss顺序,0,0,0,0,0
黑神话悟空 顺序,0,0,0,0,0
黑神话悟空第二章击杀顺序,0,0,0,0,0
黑神话悟空翠笠武师触发顺序,0,0,0,0,0
黑神话悟空花果山跳浪胶怎样触发顺序,0,0,0,0,0
黑神话悟空第一章boss顺序,0,0,0,0,0
黑神话悟空连招顺序,0,0,0,0,0
黑神话悟空开始制作时间顺序,0,0,0,0,0
黑神话悟空通关顺序,0,0,0,0,0
黑神话悟空的游玩顺序,0,0,0,0,0
黑神话悟空疯虎黄风铃通关顺序,0,0,0,0,0
黑神话悟空英雄互娱入股顺序,0,0,0,0,0
黑神话悟空走路切换顺序,0,0,0,0,0
黑神话悟空武器推荐顺序,0,0,0,0,0
黑神话悟空第四章boss顺序,0,0,0,0,0
神话黑悟空剧情详解视频播放顺序,0,0,0,0,0
黑神话悟空棍子升级顺序,0,0,0,0,0
黑神话悟空第一章打怪顺序,0,0,0,0,0
黑神话悟空关卡顺序,0,0,0,0,0
黑神话悟空四大天王出场顺序,0,0,0,0,0
黑神话悟空小说阅读顺序,0,0,0,0,0
黑神话悟空地图顺序,0,0,0,0,0
黑神话悟空创作时间顺序,0,0,0,0,0
黑神话悟空第二章打怪顺序,0,0,0,0,0
黑神话悟空二层掌灯狱使位置顺序,0,0,0,0,0
黑神话悟空妖王顺序,0,0,0,0,0
黑神话悟空十种变化收集顺序,0,0,0,0,0
黑神话悟空连招顺序图,0,0,0,0,0
黑神话悟空2021实机演示顺序,0,0,0,0,0
黑神话悟空剧情顺序,0,0,0,0,0
黑神话悟空传通关打怪的顺序是什么,0,0,0,0,0
黑神话悟空人物袁守城解锁顺序,0,0,0,0,0
黑悟空神话武器合成顺序,0,0,0,0,0
黑神话悟空第三章boss顺序,0,0,0,0,0
黑神话悟空第三章npc和boss出现顺序,0,0,0,0,0
