"""黑神话悟空""+""显示""的长尾词",长尾词数,竞价词数,全网指数,PC日均流量,移动日均流量
steam怎么显示自己玩黑神话悟空,0,0,0,0,0
黑神话悟空一直显示文件损坏怎么回事,0,0,0,0,0
黑神话悟空伤害数字显示,0,0,0,0,0
黑神话悟空怎么显示fps,0,0,0,0,0
黑神话悟空怎么设置不卡显示,0,0,0,0,0
黑神话悟空怎么开启伤害显示,0,0,0,0,0
黑神话悟空存档位置在哪里显示,0,0,0,0,0
黑神话悟空帧数显示怎么调出来,0,0,0,0,0
黑神话悟空过场剧情演示在哪显示,0,0,0,0,0
玩黑神话悟空需要什么样的显示器,0,0,0,0,0
运行黑神话悟空显示更新显卡怎么解决,0,0,0,0,0
黑神话悟空伤害数字显示在哪里设置,0,0,0,0,0
玩黑神话悟空显示器刷新率设置多少,0,0,0,0,0
黑神话悟空steam全球成就不显示百分比,0,0,0,0,0
黑神话悟空显示系统不支持怎么办,0,0,0,0,0
黑神话悟空怎么设置显示帧率,0,0,0,0,0
黑神话悟空左上角怎么显示帧数显示,0,0,0,0,0
黑神话悟空帧数显示怎么设置,0,0,0,0,0
黑神话悟空付费怎么显示要解除限制,0,0,0,0,0
黑神话悟空官方版实机演示在哪显示,0,0,0,0,0
黑神话悟空怎么显示帧数面板显示,0,0,0,0,0
黑神话悟空fps怎么显示啊,0,0,0,0,0
黑神话悟空春秋寨显示的牛是啥意思,0,0,0,0,0
黑神话悟空无法全屏显示,0,0,0,0,0
黑神话悟空需要什么显示屏,0,0,0,0,0
黑神话悟空的演示音频下载在哪显示,0,0,0,0,0
黑神话悟空人物概念图在哪显示,0,0,0,0,0
黑神话悟空概念原画在哪显示,0,0,0,0,0
黑神话悟空需要什么样的显示屏吗,0,0,0,0,0
黑神话悟空黑盒地图怎么显示暂无了,0,0,0,0,0
黑神话悟空左上角怎么显示帧数,0,0,0,0,0
黑神话悟空怎么显示帧数显示,0,0,0,0,0
黑神话悟空怎么不显示攻击伤害了,0,0,0,0,0
黑神话悟空对显示器有要求吗,0,0,0,0,0
黑神话悟空地图显示在游戏里,0,0,0,0,0
黑神话悟空怎样设置全屏显示,0,0,0,0,0
黑神话悟空着色器编译文件在哪显示,0,0,0,0,0
黑神话悟空画面显示不完整,0,0,0,0,0
黑神话悟空打不开设置显示更新驱动怎么回事,0,0,0,0,0
黑神话悟空合作显示器推荐,0,0,0,0,0
黑神话悟空怎么锁定视角显示,0,0,0,0,0
黑神话悟空3d模型显示,0,0,0,0,0
黑神话悟空不显示头上物品怎么回事,0,0,0,0,0
黑神话之悟空创作团队在哪显示,0,0,0,0,0
黑悟空神话实景拍摄在哪显示,0,0,0,0,0
黑神话悟空音乐集在哪显示,0,0,0,0,0
玩黑神话悟空画面显示有延时,0,0,0,0,0
黑神话悟空角色属性怎么显示中文,0,0,0,0,0
更新黑神话悟空有空间但显示空间不足,0,0,0,0,0
黑神话悟空显示器,0,0,0,0,0
黑神话悟空电竞显示器,0,0,0,0,0
黑神话悟空一进游戏就显示内存不足怎么办,0,0,0,0,0
黑神话悟空适配的显示器推荐,0,0,0,0,0
黑神话悟空家庭共享显示购买,0,0,0,0,0
黑神话悟空怎么显示攻击血量,0,0,0,0,0
黑神话悟空武器铸造怎么没有显示,0,0,0,0,0
黑神话悟空一直显示在修补怎么解决呢,0,0,0,0,0
黑神话悟空怎么显示道具具体数字,0,0,0,0,0
黑神话悟空对显示器要求,0,0,0,0,0
黑神话悟空怎么显示帧数,0,0,0,0,0
黑神话悟空显示设置技巧,0,0,0,0,0
黑神话悟空为什么不能全屏显示了,0,0,0,0,0
黑神话悟空怎么显示伤害信息,0,0,0,0,0
黑神话悟空打开后显示器老是黑屏怎么办,0,0,0,0,0
黑神话悟空怎么没存档显示,0,0,0,0,0
黑神话悟空如何切换怪物目标显示,0,0,0,0,0
黑神话悟空顶级画面设置在哪显示,0,0,0,0,0
黑神话悟空显示的正在运行但是没有显示,0,0,0,0,0
黑神话悟空帧率显示,0,0,0,0,0
黑神话悟空显示内存不足,0,0,0,0,0
黑神话悟空帧率显示怎么设置,0,0,0,0,0
黑神话悟空帧数显示,0,0,0,0,0
黑神话悟空显示帧率,0,0,0,0,0
黑神话悟空cg世界3d模型在哪显示,0,0,0,0,0
黑神话悟空不显示帧率怎么回事,0,0,0,0,0
怎么在黑神话悟空里调出帧数显示,0,0,0,0,0
黑神话悟空最新更新地图无法显示,0,0,0,0,0
黑神话悟空设置显示显卡更新驱动,0,0,0,0,0
黑神话悟空显示cp,0,0,0,0,0
黑神话悟空显示显卡内存不足,0,0,0,0,0
黑神话悟空怎么在游戏中打开地图功能显示,0,0,0,0,0
小黑盒黑神话悟空地图不显示怎么办,0,0,0,0,0
