"""黑神话悟空""+""作文""的长尾词",长尾词数,竞价词数,全网指数,PC日均流量,移动日均流量
黑神话悟空电影作文,0,0,0,0,0
黑神话悟空作文素材事例,0,0,0,0,0
黑神话悟空文化传承与发展有什启示作文,0,0,0,0,0
悟空黑神话作文素材例子,0,0,0,0,0
黑神话悟空涉及相关传统文化作文素材例子,0,0,0,0,0
黑神话悟空孙悟空视角作文素材,0,0,0,0,0
黑神话悟空冯骥作文素材,0,0,0,0,0
黑神话悟空创新作文,0,0,0,0,0
黑神话悟空英语作文素材,0,0,0,0,0
黑神话悟空作文高中,0,0,0,0,0
黑神话悟空事件作文素材,0,0,0,0,0
黑神话悟空人物形象作文,0,0,0,0,0
黑神话悟空作文高中生,0,0,0,0,0
黑神话悟空作文高中怎么写,0,0,0,0,0
黑神话悟空作文怎么写三年级,0,0,0,0,0
黑神话悟空作文怎么写的,0,0,0,0,0
人们对黑神话悟空为什么感到惊喜呢英语作文,0,0,0,0,0
怎么看待黑神话悟空这个人物呢作文,0,0,0,0,0
黑神话悟空与四大名著作文,0,0,0,0,0
去朋友家玩黑神话悟空作文,0,0,0,0,0
以黑神话悟空为题的作文,0,0,0,0,0
黑神话悟空时评作文,0,0,0,0,0
黑神话悟空背后的文化意义作文,0,0,0,0,0
以黑神话悟空和四大名著一人为话题的作文,0,0,0,0,0
黑神话悟空作文怎么写,0,0,0,0,0
对于黑神话悟空我们应该怎么做作文,0,0,0,0,0
黑悟空神话讲了什么故事英语作文80词,0,0,0,0,0
有关黑神话悟空的作文怎么写,0,0,0,0,0
关于黑神话悟空的作文,0,0,0,0,0
黑悟空神话讲了什么故事英语作文怎么写,0,0,0,0,0
黑神话悟空 作文素材,0,0,0,0,0
创新作文大赛黑神话悟空为主题,0,0,0,0,0
黑神话悟空话题作文ppt,0,0,0,0,0
黑神话悟空作文,0,0,0,0,0
黑悟空神话讲了什么故事英语作文,0,0,0,0,0
老外如何评价黑神话悟空的故事呢作文,0,0,0,0,0
黑悟空神话讲了什么故事英语作文带翻译,0,0,0,0,0
怎样评价黑神话悟空这本书呢作文,0,0,0,0,0
黑神话悟空相关作文素材,0,0,0,0,0
黑神话悟空作文从水浒传红楼梦三国演义概括,0,0,0,0,0
黑神话悟空作文1200字,0,0,0,0,0
黑神话悟空作文怎么写好,0,0,0,0,0
黑神话悟空主题作文,0,0,0,0,0
黑神话悟空的启示作文,0,0,0,0,0
黑神话悟空作文素材事例分析,0,0,0,0,0
创新作文大赛黑神话悟空为主题写作要求,0,0,0,0,0
黑神话悟空点评作文,0,0,0,0,0
黑神话悟空作文素材,0,0,0,0,0
黑悟空神话讲了什么故事英语作文评语,0,0,0,0,0
黑神话悟空的世界观怎么写的作文,0,0,0,0,0
怎么看待黑神话悟空的人呢作文,0,0,0,0,0
黑神话悟空作文素材高中,0,0,0,0,0
黑神话悟空英语作文,0,0,0,0,0
黑神话悟空作文素材可免费复制,0,0,0,0,0
黑神话悟空素材作文,0,0,0,0,0
黑神话悟空可以写进作文的诗句,0,0,0,0,0
黑神话悟空杨奇小作文含义揭晓,0,0,0,0,0
黑神话悟空作文800字,0,0,0,0,0
黑神话悟空的作文题目,0,0,0,0,0
黑神话悟空相关作文,0,0,0,0,0
关于黑神话悟空的作文素材,0,0,0,0,0
